{"bindings":{"acceptedClaimRefsDigest":"sha256:3dd512f84855c890125e9e6c14fb80a8d0da42a6847763b6b6c6addbe0ebe9c4","baseAccountingStateDigest":"sha256:19525f4bd2804d7bb00bb14c5da1639a9e2e575d3bdf42ace306f09637c64dbf","baseKnowledgeStateDigest":"sha256:c9458133e92111ac4df0542400598af0595ce964dd3c89b47efec0bf38b1d344","rootContractDigest":"sha256:01d52a695e88694768973f3590c0c13eb5acd8070fbed32de8ad01e460c41135","submissionDigest":"sha256:5b4f7ebc3281950a60d613dc83d7d6f3294089ac8ce9bc1c06c6dc83bdbfe1f6","submissionEvidenceManifestDigest":"sha256:f19417ba664bae83993c35298db7c0af9f578e934493c243fcd9b03ea26b5c25","targetKnowledgeStateDigest":"sha256:3e9323e362b1000d99bb9bf0c32ba56b059c908532558321036f0f6ffceb24f1","topologyAlignmentDigest":"sha256:e32ad40fb54649fbbe8313b4a048ab59667540b454b0e2b15a9edca4c6244feb"},"candidateDigest":"sha256:36d088a48216b6132d6f9f5382babcfca4a2cd3fd51b6bf254f0b67e40a347dd","descendantDepth":1,"impactContext":{"acceptedClaimRefs":[{"assessmentDigest":"sha256:d221fbbf3ff493ef9b84404f539873fe8e410e490bb077844f735327ab46b671","claimKey":"bssc-sum-capacity/marton-multiletter-finite-foundation-repair","judgmentId":"sha256:d81cf4cc1f5f2703ca77636193ba253473b9270c5f68d1f4384ac0a67d69e665","transactionId":"88a1004f309460f3ec1cacdae88d30f88559f9bc"}],"boundarySummaries":[],"contextDigest":"sha256:2f8289abb3b67876f0f28b784c18f69336ad21b5d854916beb87337c48469161","descendantDepth":1,"expansionPolicy":{"allowedKinds":["program","thread"],"maximumDescendantDepth":4,"requiresExactBuilderNode":true},"includedNodes":[{"parentRef":null,"recordDigest":"sha256:6c667e70ec5eeb0bbca5cc382893b021b8e4dff33403e3ec09d92532f24e49dd","ref":{"id":"root","kind":"program"},"roles":["ancestor","seed","seed-owner"],"status":"active"},{"parentRef":{"id":"root","kind":"program"},"recordDigest":"sha256:b9dcb917359a21c184538fcd5afde2659b0ec70a3c8b37cda415f835ceb7af26","ref":{"id":"root/code-structure-converse","kind":"program"},"roles":["descendant","sibling-decision-point"],"status":"active"},{"parentRef":{"id":"root","kind":"program"},"recordDigest":"sha256:9e2d5f65b5d7fb621be9b028ba18577c20ffb8d8d35cb6b5b20e9f4c489d1c06","ref":{"id":"root/multiletter-marton-achievability","kind":"program"},"roles":["descendant","seed","seed-owner","sibling-decision-point"],"status":"active"},{"parentRef":{"id":"root","kind":"program"},"recordDigest":"sha256:fc129ebc86b318e8a8c08037a21bfd1de61cb4401f11d9e1a8ae3b10cf1e634d","ref":{"id":"root/theorem9-auxiliary-receiver-converse","kind":"program"},"roles":["descendant","sibling-decision-point"],"status":"active"},{"parentRef":{"id":"root","kind":"program"},"recordDigest":"sha256:fcc703456c24e5b4761dfb3ffca9cee02cb267bebe124a36811b185069a0daec","ref":{"id":"root/uv-scalar-converse","kind":"program"},"roles":["descendant","sibling-decision-point"],"status":"active"},{"parentRef":{"id":"root/code-structure-converse","kind":"program"},"recordDigest":"sha256:be35b9071e3c1771d6de37cf8dedb082627ae39b1a8d02daa2cd2d4b401de358","ref":{"id":"root/code-structure-converse/dependence-balance-and-channel-refinement","kind":"thread"},"roles":["local-thread"],"status":"active"},{"parentRef":{"id":"root/code-structure-converse","kind":"program"},"recordDigest":"sha256:21542d60cc740c3de51655b277c1d05f68529005f8a3320e510f5e3b0dab75ef","ref":{"id":"root/code-structure-converse/unstructured-search","kind":"thread"},"roles":["local-thread"],"status":"active"},{"parentRef":{"id":"root","kind":"program"},"recordDigest":"sha256:679d41ee0298d910e1478e4db57c4c44219afe8fef3abbdb7f461e27857d0234","ref":{"id":"root/multiletter-marton-achievability-agenda","kind":"thread"},"roles":["local-thread","seed"],"status":"active"},{"parentRef":{"id":"root/multiletter-marton-achievability","kind":"program"},"recordDigest":"sha256:dcaaa20d57507eb13133345aaea93697c978793f9d06c3c6d389c878ec78c6eb","ref":{"id":"root/multiletter-marton-achievability/conditional-product-and-correlation-pruning","kind":"thread"},"roles":["local-thread","seed"],"status":"active"},{"parentRef":{"id":"root/multiletter-marton-achievability","kind":"program"},"recordDigest":"sha256:6fcf79adb059247646b2762e903a027bdac85c4dd1efda87fc151390be5eb060","ref":{"id":"root/multiletter-marton-achievability/support-pruning","kind":"thread"},"roles":["local-thread"],"status":"active"},{"parentRef":{"id":"root/multiletter-marton-achievability","kind":"program"},"recordDigest":"sha256:8de09a54e8183a3e9e37be60847de87b58b5595e9c54d7b7ea5bbed6dead8baa","ref":{"id":"root/multiletter-marton-achievability/unstructured-search","kind":"thread"},"roles":["local-thread"],"status":"active"},{"parentRef":{"id":"root","kind":"program"},"recordDigest":"sha256:45531074e7461c936ed926a0ca2727a7bba0463ec6b499a57982fb62dae84663","ref":{"id":"root/theorem9-auxiliary-receiver-converse-agenda","kind":"thread"},"roles":["local-thread"],"status":"active"},{"parentRef":{"id":"root/theorem9-auxiliary-receiver-converse","kind":"program"},"recordDigest":"sha256:e652298666da8a0fd022290925ba0067d21b2f217bdf432209dd068673c50a4c","ref":{"id":"root/theorem9-auxiliary-receiver-converse/r0-specialization-and-receiver-reduction","kind":"thread"},"roles":["local-thread"],"status":"active"},{"parentRef":{"id":"root/theorem9-auxiliary-receiver-converse","kind":"program"},"recordDigest":"sha256:9f9280bbd49ae9d9fe41e5be39a13387a647aaf4dad7087c14b367b76b4f1036","ref":{"id":"root/theorem9-auxiliary-receiver-converse/unstructured-search","kind":"thread"},"roles":["local-thread"],"status":"active"},{"parentRef":{"id":"root","kind":"program"},"recordDigest":"sha256:593d11c9f455aa91fa91e9083a6bb6ffcf4823726f6843239f552eb8fe24b48e","ref":{"id":"root/unstructured-search","kind":"thread"},"roles":["local-thread"],"status":"active"},{"parentRef":{"id":"root","kind":"program"},"recordDigest":"sha256:1ec5b7ce786e9f1df13aab296e9407b0ecb76bc59c6201f87f03e4b745fb5e18","ref":{"id":"root/uv-scalar-converse-agenda","kind":"thread"},"roles":["local-thread"],"status":"active"},{"parentRef":{"id":"root/uv-scalar-converse","kind":"program"},"recordDigest":"sha256:206803453dcc63f60aef83904eb09d1b3a6ac2265b0581baa29798b977b9bd7d","ref":{"id":"root/uv-scalar-converse/product-and-skew-symmetry","kind":"thread"},"roles":["local-thread"],"status":"active"},{"parentRef":{"id":"root/uv-scalar-converse","kind":"program"},"recordDigest":"sha256:e3cb2726702d8a286ee254ceafdd5251f4412e4222fc7678ffc1c59be356dd9e","ref":{"id":"root/uv-scalar-converse/unstructured-search","kind":"thread"},"roles":["local-thread"],"status":"active"}],"knowledgeStateDigest":"sha256:3e9323e362b1000d99bb9bf0c32ba56b059c908532558321036f0f6ffceb24f1","problemId":"bssc-sum-capacity","schemaVersion":1,"seedNodeRefs":[{"id":"root/multiletter-marton-achievability","kind":"program"},{"id":"root/multiletter-marton-achievability-agenda","kind":"thread"},{"id":"root/multiletter-marton-achievability/conditional-product-and-correlation-pruning","kind":"thread"}],"semanticItemRefs":[{"claimRefs":[{"claimKey":"bssc-sum-capacity/code-induced-dependence-balance-and-entropy-no-go","transactionId":"c70e1829a7c6a2a8cb8cfc2383f8abf825ac5ea6"}],"dependencyItemIds":["root/code-structure-converse/finite-block-balance-proof"],"itemId":"root/code-structure-converse/code-induced-dependence-balance","itemType":"result","programRef":{"id":"root/code-structure-converse","kind":"program"},"recordDigest":"sha256:f7f13394e11395e8d2f2728659d807142ed525017b688668eefdbfd92b06810d"},{"claimRefs":[],"dependencyItemIds":["root/code-structure-converse/entropy-counterfeit-witness"],"itemId":"root/code-structure-converse/copy-extension-proof","itemType":"proof","programRef":{"id":"root/code-structure-converse","kind":"program"},"recordDigest":"sha256:7d4d8300feed467f40d7cab85ca12c51db03fb897daf2c88ae3aca9e8b11d2bf"},{"claimRefs":[{"claimKey":"bssc-sum-capacity/code-induced-dependence-balance-and-entropy-no-go","transactionId":"c70e1829a7c6a2a8cb8cfc2383f8abf825ac5ea6"}],"dependencyItemIds":["root/code-structure-converse/copy-extension-proof","root/code-structure-converse/entropy-counterfeit-witness"],"itemId":"root/code-structure-converse/entropy-copy-no-go","itemType":"result","programRef":{"id":"root/code-structure-converse","kind":"program"},"recordDigest":"sha256:4d3e3bb55a0cf45bcf1ed21e6dc7fbbc3462691f9b2907fa300128bd53a97d83"},{"claimRefs":[],"dependencyItemIds":["root/code-structure-converse/code-induced-dependence-balance"],"itemId":"root/code-structure-converse/entropy-counterfeit-witness","itemType":"computation","programRef":{"id":"root/code-structure-converse","kind":"program"},"recordDigest":"sha256:051254fb85f0e7177352428a4a9c735952678f44d3b7ed4242885bd43e8a9a56"},{"claimRefs":[],"dependencyItemIds":["root/code-structure-converse/entropy-counterfeit-witness"],"itemId":"root/code-structure-converse/exact-witness-checker","itemType":"tool","programRef":{"id":"root/code-structure-converse","kind":"program"},"recordDigest":"sha256:caeffc0ea1de4056a6c4e5691e5bf171b8d8197a6eae501fe6f1d8c1921d2e30"},{"claimRefs":[],"dependencyItemIds":[],"itemId":"root/code-structure-converse/finite-block-balance-proof","itemType":"proof","programRef":{"id":"root/code-structure-converse","kind":"program"},"recordDigest":"sha256:6b5eb4b706c1b19bdc51166ed41e9daa809d20f3bca4deaa44903d8fa8d8de3b"},{"claimRefs":[],"dependencyItemIds":["root/multiletter-marton-achievability/conditional-product-tensorization-proof","root/multiletter-marton-achievability/tuple-correlation-residual-proof"],"itemId":"root/multiletter-marton-achievability/conditional-product-ledger-verifier","itemType":"tool","programRef":{"id":"root/multiletter-marton-achievability","kind":"program"},"recordDigest":"sha256:cd0afa6704c01622119f28cd6179a03864e72b2d7b5f474de28c9d7ef26e4a8b"},{"claimRefs":[{"claimKey":"bssc-sum-capacity/conditional-product-marton-no-gain","transactionId":"5ed3f525b9ae7f32c6e1dcbf22ecdb5ae946a4a6"}],"dependencyItemIds":["root/multiletter-marton-achievability/conditional-product-ledger-verifier","root/multiletter-marton-achievability/co